{
    "seo_strategy_id": "seo_3f6e21ac14293e9e",
    "brief_id": "brief_c9df24ebd3caadc3",
    "report_id": "rr_nurse-insurance-001",
    "decision_id": "dec_5a72a02d941b64cf",
    "strategy_id": "strat_b3b603669ce28f7e",
    "primary_keyword": "nurse malpractice insurance",
    "secondary_keywords": [],
    "search_intent": "informational",
    "title_requirements": [
        "Align title with the primary keyword: nurse malpractice insurance",
        "Match the confirmed search intent."
    ],
    "meta_description_requirements": [
        "Summarize the page accurately",
        "Reflect the primary topic: nurse malpractice insurance"
    ],
    "heading_requirements": [
        "Introduction",
        "What You Need to Know",
        "Coverage and Key Factors",
        "Costs and Pricing Factors",
        "How to Compare Options",
        "Frequently Asked Questions",
        "Sources and Editorial Methodology"
    ],
    "topical_entities": [
        "None"
    ],
    "questions_to_answer": [
        "None"
    ],
    "internal_link_targets": [],
    "schema_requirements": [
        "Use only structured data supported by the final published content."
    ],
    "image_alt_requirements": [
        "Describe informative images accurately and concisely; do not keyword-stuff alt text."
    ],
    "evidence_refs": [
        "ev_899bc35030db6ae9",
        "ev_serp_result_1dfd80ac28203140",
        "ev_serp_result_8e45435f00c143c6",
        "ev_serp_result_a3f96ce427b6974f",
        "ev_serp_result_5bfd1fd50de648a3",
        "ev_serp_result_2de2d64056406274",
        "ev_serp_result_9a68454cd73e3ecb",
        "ev_serp_result_bd0df13dc61ed0fd",
        "ev_serp_result_35b542cb41966888",
        "ev_serp_distribution_f35a41bbb73f418a",
        "ev_serp_dominant_f35a41bbb73f418a",
        "ev_serp_mixed_f35a41bbb73f418a",
        "ev_intent_alignment_3dda34e37d41f549",
        "ev_serp_strategy_8f3e0ccc47044226",
        "ev_37000010b6cdf166ebe7f211",
        "ev_88601f584f5ce576aa293d8f",
        "ev_8c755ee156753574a21b3693",
        "ev_bc04eb32b2d4d7d2cb892534",
        "ev_000b6ff1d883e4b236e2a255",
        "ev_32f29ba58089e24071ef7400",
        "ev_561ac6e1712acee51c031d51",
        "ev_939ba9bd6af24af6227db5ec",
        "ev_f07dea65e3c438cc915ba742",
        "ev_b6bcf2035ad8fc7a2a8aa12e",
        "ev_dc6781ac11ed7d77500d45ef",
        "ev_7647b34b28d27f0904a7c003",
        "ev_a8b52a0511bb73d1b3cf5c99",
        "ev_194594d3915805696e43e930",
        "ev_7df87bec6e46cd6af0b27229",
        "ev_78f3d450713da5ef9ca7f529",
        "ev_61ef469e7aa2ba63cd9b6d87",
        "ev_4762cfc4c3e58e4fd43b1c54",
        "ev_f7943ffb9fdb21b1fd3c8a5f",
        "ev_62b47393bada549c000e90c1",
        "ev_bf9d4f9e6ac89f749caea030",
        "ev_e6ca8764ba88910b5bfc46c2",
        "ev_5a7caa9e12247cd1389aed0f",
        "ev_e75d12b51b25eaf885fdef37",
        "ev_c5e74c2c8306d3edd88f6cb5",
        "ev_28b93b4ce2312b1f21f25a16",
        "ev_f3f5380b7543aacc1bc4a1e7",
        "ev_5db43ca25ad033763a318519",
        "ev_fda919b2068258f950c3d5f1",
        "ev_5a36575cf6dafcf6ff592d6a",
        "ev_03d3deddc7aa3467e8c6751e"
    ],
    "schema_version": "1.0",
    "lifecycle_stage": "seo_strategy_ready",
    "audit": {
        "method": "research_grounded_seo_strategy",
        "version": "v1",
        "validation_status": "validated"
    }
}