{
    "seo_strategy_id": "seo_19642ec41765d0ef",
    "brief_id": "brief_5a11bbf89436675e",
    "report_id": "rr_m7-consultant-liability",
    "decision_id": "dec_726d75c366d569aa",
    "strategy_id": "strat_1fa6e1f92f0119d0",
    "primary_keyword": "consultant professional liability insurance",
    "secondary_keywords": [],
    "search_intent": "informational",
    "title_requirements": [
        "Align title with the primary keyword: consultant professional liability insurance",
        "Match the confirmed search intent."
    ],
    "meta_description_requirements": [
        "Summarize the page accurately",
        "Reflect the primary topic: consultant professional liability insurance"
    ],
    "heading_requirements": [
        "Introduction",
        "What You Need to Know",
        "Coverage and Key Factors",
        "Costs and Pricing Factors",
        "How to Compare Options",
        "Frequently Asked Questions",
        "Sources and Editorial Methodology"
    ],
    "topical_entities": [
        "None"
    ],
    "questions_to_answer": [
        "None"
    ],
    "internal_link_targets": [],
    "schema_requirements": [
        "Use only structured data supported by the final published content."
    ],
    "image_alt_requirements": [
        "Describe informative images accurately and concisely; do not keyword-stuff alt text."
    ],
    "evidence_refs": [
        "ev_9a2aedbda182447f",
        "ev_serp_result_e444932ffdbdcf4c",
        "ev_serp_result_ff1b4f79644246be",
        "ev_serp_result_a313311899a979c3",
        "ev_serp_result_c1d68f3c48a13f97",
        "ev_serp_result_cba8fb55be152463",
        "ev_serp_distribution_5bd5f8181a2685d0",
        "ev_serp_dominant_5bd5f8181a2685d0",
        "ev_serp_mixed_5bd5f8181a2685d0",
        "ev_intent_alignment_b80d94868d8444df",
        "ev_serp_strategy_ad409d2a44c3792b",
        "ev_b68e2e74a3d8d68d7f0b6f28",
        "ev_d0ee01a51f13063e7d47c3d3",
        "ev_f27f204e172f0bc28f509ce8",
        "ev_ad6b4817da573d3539e55967",
        "ev_7be8f8d28256603c97e78523",
        "ev_9e4fd2bf505c53588b7dca01",
        "ev_75c4849a49f1e0ec17c3ca9d",
        "ev_3c101e172deffec73fc173d2",
        "ev_e08d48a1e6c8769e7f384c56",
        "ev_11d67e0727eee22468ec7721",
        "ev_c4d36efbb9712e7962801f0a",
        "ev_4facf32aac256200c3945fd1",
        "ev_aacb3b16843de77896baf355",
        "ev_c6ca61471538bfcf327d46a6",
        "ev_99663307d0614f16c33e393b",
        "ev_e4c24c3305be8fd806939e56",
        "ev_b157e1257743122ff7d6c68b",
        "ev_db081695cfad6d9d69e187b8",
        "ev_259d00013793f1213fcd7cd7",
        "editorial_page_hartford_intro_20260825",
        "editorial_page_hartford_faq_20260825",
        "editorial_page_hiscox_basics_20260825",
        "editorial_page_hartford_consultants_20260825",
        "editorial_page_hiscox_20260824",
        "editorial_page_hartford_20260824",
        "editorial_page_cornell_20260824",
        "editorial_page_insureon_consulting_cost_20260825",
        "editorial_page_hartford_consultant_cost_20260825",
        "editorial_page_insureon_pli_cost_20260825",
        "editorial_page_insureon_compare_20260825",
        "editorial_page_hartford_claims_made_20260825",
        "editorial_page_insureon_pli_claim_20260825",
        "editorial_article_methodology_20260825",
        "editorial_page_hartford_faq_workflow_20260825",
        "editorial_page_hartford_faq_coverage_20260825",
        "editorial_page_hartford_faq_need_20260825",
        "editorial_page_insureon_faq_consultants_20260825"
    ],
    "schema_version": "1.0",
    "lifecycle_stage": "seo_strategy_ready",
    "audit": {
        "method": "research_grounded_seo_strategy",
        "version": "v1",
        "validation_status": "validated"
    }
}