{
    "seo_strategy_id": "seo_30d165dd2d5ece5f",
    "brief_id": "brief_307d3844e157d046",
    "report_id": "rr_consultant-liability-001",
    "decision_id": "dec_e1584255c243e32e",
    "strategy_id": "strat_287a125188f1fa58",
    "primary_keyword": "consultant professional liability insurance",
    "secondary_keywords": [],
    "search_intent": "informational",
    "title_requirements": [
        "Align title with the primary keyword: consultant professional liability insurance",
        "Match the confirmed search intent."
    ],
    "meta_description_requirements": [
        "Summarize the page accurately",
        "Reflect the primary topic: consultant professional liability insurance"
    ],
    "heading_requirements": [
        "Introduction",
        "What You Need to Know",
        "Coverage and Key Factors",
        "Costs and Pricing Factors",
        "How to Compare Options",
        "Frequently Asked Questions",
        "Sources and Editorial Methodology"
    ],
    "topical_entities": [
        "None"
    ],
    "questions_to_answer": [
        "None"
    ],
    "internal_link_targets": [],
    "schema_requirements": [
        "Use only structured data supported by the final published content."
    ],
    "image_alt_requirements": [
        "Describe informative images accurately and concisely; do not keyword-stuff alt text."
    ],
    "evidence_refs": [
        "ev_38bcc746245f3993",
        "ev_serp_result_ad3f9c5d517ee7a3",
        "ev_serp_result_0b4f0e3e89b560da",
        "ev_serp_result_8856d08332fc1f99",
        "ev_serp_result_adbaaf5998cff652",
        "ev_serp_result_f5861312f10acc17",
        "ev_serp_result_d9109168f9828f23",
        "ev_serp_result_687dc6ca2e964d97",
        "ev_serp_result_0af6a8d66839d48b",
        "ev_serp_result_31128a05b7969821",
        "ev_serp_distribution_0eaf56d310a3673f",
        "ev_serp_dominant_0eaf56d310a3673f",
        "ev_serp_mixed_0eaf56d310a3673f",
        "ev_intent_alignment_8695d6e6a56f05ea",
        "ev_serp_strategy_85839d0c5cd36e9e",
        "ev_89320d48ff2fdc8ce4acb907",
        "ev_2e099f8b863f5fd06a002fa2",
        "ev_c42ca47267d6182e775ab7b6",
        "ev_82044afa62d5a9fa34b71660",
        "ev_242a1da02e28d4b8e94934a9",
        "ev_3db70af81d0202181ba038b0",
        "ev_13b5c7a50df53a31dacc96f7",
        "ev_e49d520a86423ad0c133029a",
        "ev_2714a4d4356757c0050eb839",
        "ev_163e6f50db6033107903c88a",
        "ev_253e3e2fb52e0b77a75f7dff",
        "ev_96afac819e82d0a9e9fdf606",
        "ev_ebcdfc0c7e0017361e9fe724",
        "ev_1f155f288cfb6518e1c2f067",
        "ev_035ff911d4d1e42b271d0609",
        "ev_93d81c198fbb77d45f4ccb29",
        "ev_6db7e751a17291dd8d4b328c",
        "ev_2a1c8061f9ea60696d2355b5",
        "ev_83a097554b74b088df37324f",
        "ev_fca5f1f4b9cf86c6ca9a5e56",
        "ev_7568e04c80cc0c24a7c41ac6",
        "ev_f53671ba6f22c2f137dadf63",
        "ev_90ad169da3aa6ae2390439de",
        "ev_e171eeed459b5e7cc87d2b99",
        "ev_9289006451aecfa3be4f4fe4",
        "ev_9d7a29711bcc70c90102a7ff",
        "ev_59e9ee2d6541c56d8f39232b",
        "ev_d8c2f8858ffc24b804271f2c",
        "ev_70b85a9f517f84723e1adfec",
        "ev_d7a1408f4e667e31693f3c8d",
        "ev_59ac68cfccaf468fa76b839b"
    ],
    "schema_version": "1.0",
    "lifecycle_stage": "seo_strategy_ready",
    "audit": {
        "method": "research_grounded_seo_strategy",
        "version": "v1",
        "validation_status": "validated"
    }
}